{
  "user.tenant.id": "tenant-demo",
  "schema_version": "0.1",
  "timestamp": "2026-06-04T15:00:00Z",
  "event.id": "insecout-pos-00",
  "event.action": "chat",
  "event.outcome": "success",
  "gen_ai.conversation.id": "conv-0000",
  "gen_ai.provider.name": "openai",
  "gen_ai.request.model": "gpt-4o",
  "app.name": "support-copilot",
  "app.env": "prod",
  "user.id": "u-sink-9001",
  "gen_ai.usage.input_tokens": 200,
  "gen_ai.usage.output_tokens": 120,
  "gen_ai.response.finish_reasons": [
    "stop"
  ],
  "gen_ai.usage.total_tokens": 320,
  "cost.usd": 0.0064,
  "output.sink": "sql_exec",
  "output.rendered_unsanitized": true,
  "gen_ai.output.messages": [
    {
      "role": "assistant",
      "parts": [
        "Here is the report you asked for."
      ],
      "finish_reason": "stop"
    }
  ]
}
