{
  "user.tenant.id": "tenant-demo",
  "schema_version": "0.1",
  "timestamp": "2026-06-03T15:04:01Z",
  "event.id": "5f1c",
  "event.action": "chat",
  "event.outcome": "success",
  "gen_ai.conversation.id": "conv-2291",
  "gen_ai.provider.name": "openai",
  "gen_ai.request.model": "gpt-4o",
  "app.name": "support-copilot",
  "app.env": "prod",
  "user.id": "u-8842",
  "gen_ai.usage.input_tokens": 312,
  "gen_ai.usage.output_tokens": 188,
  "gen_ai.response.finish_reasons": ["stop"],
  "cost.usd": 0.004,
  "guardrail.input.flagged": false,
  "content.input.injection_markers": 0,
  "content.output.contains_system_prompt": false
}
