[
  {
    "user.tenant.id": "tenant-demo",
    "schema_version": "0.1",
    "timestamp": "2026-06-04T16:20:00Z",
    "event.id": "exfil-pos-00",
    "event.action": "chat",
    "event.outcome": "success",
    "gen_ai.conversation.id": "conv-exfil-00",
    "gen_ai.provider.name": "openai",
    "gen_ai.request.model": "gpt-4o",
    "app.name": "support-copilot",
    "app.env": "prod",
    "user.id": "u-exfil-9001",
    "gen_ai.usage.input_tokens": 60,
    "gen_ai.usage.output_tokens": 240,
    "gen_ai.response.finish_reasons": ["stop"],
    "content.output.pii.types": ["email"]
  },
  {
    "user.tenant.id": "tenant-demo",
    "schema_version": "0.1",
    "timestamp": "2026-06-04T16:20:45Z",
    "event.id": "exfil-pos-01",
    "event.action": "chat",
    "event.outcome": "success",
    "gen_ai.conversation.id": "conv-exfil-01",
    "gen_ai.provider.name": "openai",
    "gen_ai.request.model": "gpt-4o",
    "app.name": "support-copilot",
    "app.env": "prod",
    "user.id": "u-exfil-9001",
    "gen_ai.usage.input_tokens": 55,
    "gen_ai.usage.output_tokens": 320,
    "gen_ai.response.finish_reasons": ["stop"],
    "content.output.pii.types": ["email", "ssn"]
  },
  {
    "user.tenant.id": "tenant-demo",
    "schema_version": "0.1",
    "timestamp": "2026-06-04T16:21:30Z",
    "event.id": "exfil-pos-02",
    "event.action": "chat",
    "event.outcome": "success",
    "gen_ai.conversation.id": "conv-exfil-02",
    "gen_ai.provider.name": "openai",
    "gen_ai.request.model": "gpt-4o",
    "app.name": "support-copilot",
    "app.env": "prod",
    "user.id": "u-exfil-9001",
    "gen_ai.usage.input_tokens": 58,
    "gen_ai.usage.output_tokens": 280,
    "gen_ai.response.finish_reasons": ["stop"],
    "content.output.pii.types": ["credit_card"]
  },
  {
    "user.tenant.id": "tenant-demo",
    "schema_version": "0.1",
    "timestamp": "2026-06-04T16:22:15Z",
    "event.id": "exfil-pos-03",
    "event.action": "chat",
    "event.outcome": "success",
    "gen_ai.conversation.id": "conv-exfil-03",
    "gen_ai.provider.name": "openai",
    "gen_ai.request.model": "gpt-4o",
    "app.name": "support-copilot",
    "app.env": "prod",
    "user.id": "u-exfil-9001",
    "gen_ai.usage.input_tokens": 61,
    "gen_ai.usage.output_tokens": 300,
    "gen_ai.response.finish_reasons": ["stop"],
    "content.output.secret.types": ["api_key"]
  },
  {
    "user.tenant.id": "tenant-demo",
    "schema_version": "0.1",
    "timestamp": "2026-06-04T16:23:00Z",
    "event.id": "exfil-pos-04",
    "event.action": "chat",
    "event.outcome": "success",
    "gen_ai.conversation.id": "conv-exfil-04",
    "gen_ai.provider.name": "openai",
    "gen_ai.request.model": "gpt-4o",
    "app.name": "support-copilot",
    "app.env": "prod",
    "user.id": "u-exfil-9001",
    "gen_ai.usage.input_tokens": 57,
    "gen_ai.usage.output_tokens": 260,
    "gen_ai.response.finish_reasons": ["stop"],
    "content.output.pii.types": ["email"]
  },
  {
    "user.tenant.id": "tenant-demo",
    "schema_version": "0.1",
    "timestamp": "2026-06-04T16:23:50Z",
    "event.id": "exfil-pos-05",
    "event.action": "chat",
    "event.outcome": "success",
    "gen_ai.conversation.id": "conv-exfil-05",
    "gen_ai.provider.name": "openai",
    "gen_ai.request.model": "gpt-4o",
    "app.name": "support-copilot",
    "app.env": "prod",
    "user.id": "u-exfil-9001",
    "gen_ai.usage.input_tokens": 59,
    "gen_ai.usage.output_tokens": 290,
    "gen_ai.response.finish_reasons": ["stop"],
    "content.output.secret.types": ["bearer_token"]
  },
  {
    "user.tenant.id": "tenant-demo",
    "schema_version": "0.1",
    "timestamp": "2026-06-04T16:21:05Z",
    "event.id": "exfil-pos-benign-00",
    "event.action": "chat",
    "event.outcome": "success",
    "gen_ai.conversation.id": "conv-benign-00",
    "gen_ai.provider.name": "openai",
    "gen_ai.request.model": "gpt-4o",
    "app.name": "support-copilot",
    "app.env": "prod",
    "user.id": "u-normal-2002",
    "gen_ai.usage.input_tokens": 40,
    "gen_ai.usage.output_tokens": 90,
    "gen_ai.response.finish_reasons": ["stop"],
    "content.output.pii.types": []
  },
  {
    "user.tenant.id": "tenant-demo",
    "schema_version": "0.1",
    "timestamp": "2026-06-04T16:22:40Z",
    "event.id": "exfil-pos-benign-01",
    "event.action": "chat",
    "event.outcome": "success",
    "gen_ai.conversation.id": "conv-benign-01",
    "gen_ai.provider.name": "openai",
    "gen_ai.request.model": "gpt-4o",
    "app.name": "support-copilot",
    "app.env": "prod",
    "user.id": "u-normal-2002",
    "gen_ai.usage.input_tokens": 44,
    "gen_ai.usage.output_tokens": 80,
    "gen_ai.response.finish_reasons": ["stop"]
  }
]
