[
  {
    "user.tenant.id": "tenant-demo",
    "schema_version": "0.1",
    "timestamp": "2026-06-04T15:00:00Z",
    "event.id": "loop-pos-00",
    "event.action": "chat",
    "event.outcome": "success",
    "gen_ai.conversation.id": "conv-loop-3001",
    "gen_ai.provider.name": "openai",
    "gen_ai.request.model": "gpt-4o",
    "app.name": "support-copilot",
    "app.env": "prod",
    "user.id": "u-loop-3001",
    "gen_ai.usage.input_tokens": 200,
    "gen_ai.usage.output_tokens": 4096,
    "gen_ai.response.finish_reasons": [
      "length"
    ],
    "gen_ai.usage.total_tokens": 4296,
    "cost.usd": 0.08592
  },
  {
    "user.tenant.id": "tenant-demo",
    "schema_version": "0.1",
    "timestamp": "2026-06-04T15:00:30Z",
    "event.id": "loop-pos-01",
    "event.action": "chat",
    "event.outcome": "success",
    "gen_ai.conversation.id": "conv-loop-3001",
    "gen_ai.provider.name": "openai",
    "gen_ai.request.model": "gpt-4o",
    "app.name": "support-copilot",
    "app.env": "prod",
    "user.id": "u-loop-3001",
    "gen_ai.usage.input_tokens": 200,
    "gen_ai.usage.output_tokens": 4096,
    "gen_ai.response.finish_reasons": [
      "length"
    ],
    "gen_ai.usage.total_tokens": 4296,
    "cost.usd": 0.08592
  },
  {
    "user.tenant.id": "tenant-demo",
    "schema_version": "0.1",
    "timestamp": "2026-06-04T15:01:00Z",
    "event.id": "loop-pos-02",
    "event.action": "chat",
    "event.outcome": "success",
    "gen_ai.conversation.id": "conv-loop-3001",
    "gen_ai.provider.name": "openai",
    "gen_ai.request.model": "gpt-4o",
    "app.name": "support-copilot",
    "app.env": "prod",
    "user.id": "u-loop-3001",
    "gen_ai.usage.input_tokens": 200,
    "gen_ai.usage.output_tokens": 4096,
    "gen_ai.response.finish_reasons": [
      "length"
    ],
    "gen_ai.usage.total_tokens": 4296,
    "cost.usd": 0.08592
  },
  {
    "user.tenant.id": "tenant-demo",
    "schema_version": "0.1",
    "timestamp": "2026-06-04T15:01:30Z",
    "event.id": "loop-pos-03",
    "event.action": "chat",
    "event.outcome": "success",
    "gen_ai.conversation.id": "conv-loop-3001",
    "gen_ai.provider.name": "openai",
    "gen_ai.request.model": "gpt-4o",
    "app.name": "support-copilot",
    "app.env": "prod",
    "user.id": "u-loop-3001",
    "gen_ai.usage.input_tokens": 200,
    "gen_ai.usage.output_tokens": 4096,
    "gen_ai.response.finish_reasons": [
      "length"
    ],
    "gen_ai.usage.total_tokens": 4296,
    "cost.usd": 0.08592
  },
  {
    "user.tenant.id": "tenant-demo",
    "schema_version": "0.1",
    "timestamp": "2026-06-04T15:02:00Z",
    "event.id": "loop-pos-04",
    "event.action": "chat",
    "event.outcome": "success",
    "gen_ai.conversation.id": "conv-loop-3001",
    "gen_ai.provider.name": "openai",
    "gen_ai.request.model": "gpt-4o",
    "app.name": "support-copilot",
    "app.env": "prod",
    "user.id": "u-loop-3001",
    "gen_ai.usage.input_tokens": 200,
    "gen_ai.usage.output_tokens": 4096,
    "gen_ai.response.finish_reasons": [
      "length"
    ],
    "gen_ai.usage.total_tokens": 4296,
    "cost.usd": 0.08592
  },
  {
    "user.tenant.id": "tenant-demo",
    "schema_version": "0.1",
    "timestamp": "2026-06-04T15:02:30Z",
    "event.id": "loop-pos-05",
    "event.action": "chat",
    "event.outcome": "success",
    "gen_ai.conversation.id": "conv-loop-3001",
    "gen_ai.provider.name": "openai",
    "gen_ai.request.model": "gpt-4o",
    "app.name": "support-copilot",
    "app.env": "prod",
    "user.id": "u-loop-3001",
    "gen_ai.usage.input_tokens": 200,
    "gen_ai.usage.output_tokens": 4096,
    "gen_ai.response.finish_reasons": [
      "length"
    ],
    "gen_ai.usage.total_tokens": 4296,
    "cost.usd": 0.08592
  }
]
