[
  {
    "user.tenant.id": "tenant-demo",
    "schema_version": "0.1",
    "timestamp": "2026-06-04T15:00:00Z",
    "event.id": "pos-00",
    "event.action": "chat",
    "event.outcome": "success",
    "gen_ai.conversation.id": "conv-pos-00",
    "gen_ai.provider.name": "openai",
    "gen_ai.request.model": "gpt-4o",
    "app.name": "support-copilot",
    "app.env": "prod",
    "user.id": "u-burst-9001",
    "gen_ai.usage.input_tokens": 7200,
    "gen_ai.usage.output_tokens": 4800,
    "gen_ai.usage.total_tokens": 12000,
    "gen_ai.response.finish_reasons": [
      "length"
    ],
    "cost.usd": 0.18
  },
  {
    "user.tenant.id": "tenant-demo",
    "schema_version": "0.1",
    "timestamp": "2026-06-04T15:00:20Z",
    "event.id": "pos-01",
    "event.action": "chat",
    "event.outcome": "success",
    "gen_ai.conversation.id": "conv-pos-01",
    "gen_ai.provider.name": "openai",
    "gen_ai.request.model": "gpt-4o",
    "app.name": "support-copilot",
    "app.env": "prod",
    "user.id": "u-burst-9001",
    "gen_ai.usage.input_tokens": 7320,
    "gen_ai.usage.output_tokens": 4880,
    "gen_ai.usage.total_tokens": 12200,
    "gen_ai.response.finish_reasons": [
      "length"
    ],
    "cost.usd": 0.183
  },
  {
    "user.tenant.id": "tenant-demo",
    "schema_version": "0.1",
    "timestamp": "2026-06-04T15:00:40Z",
    "event.id": "pos-02",
    "event.action": "chat",
    "event.outcome": "success",
    "gen_ai.conversation.id": "conv-pos-02",
    "gen_ai.provider.name": "openai",
    "gen_ai.request.model": "gpt-4o",
    "app.name": "support-copilot",
    "app.env": "prod",
    "user.id": "u-burst-9001",
    "gen_ai.usage.input_tokens": 7440,
    "gen_ai.usage.output_tokens": 4960,
    "gen_ai.usage.total_tokens": 12400,
    "gen_ai.response.finish_reasons": [
      "length"
    ],
    "cost.usd": 0.186
  },
  {
    "user.tenant.id": "tenant-demo",
    "schema_version": "0.1",
    "timestamp": "2026-06-04T15:01:00Z",
    "event.id": "pos-03",
    "event.action": "chat",
    "event.outcome": "success",
    "gen_ai.conversation.id": "conv-pos-03",
    "gen_ai.provider.name": "openai",
    "gen_ai.request.model": "gpt-4o",
    "app.name": "support-copilot",
    "app.env": "prod",
    "user.id": "u-burst-9001",
    "gen_ai.usage.input_tokens": 7560,
    "gen_ai.usage.output_tokens": 5040,
    "gen_ai.usage.total_tokens": 12600,
    "gen_ai.response.finish_reasons": [
      "length"
    ],
    "cost.usd": 0.189
  },
  {
    "user.tenant.id": "tenant-demo",
    "schema_version": "0.1",
    "timestamp": "2026-06-04T15:01:20Z",
    "event.id": "pos-04",
    "event.action": "chat",
    "event.outcome": "success",
    "gen_ai.conversation.id": "conv-pos-04",
    "gen_ai.provider.name": "openai",
    "gen_ai.request.model": "gpt-4o",
    "app.name": "support-copilot",
    "app.env": "prod",
    "user.id": "u-burst-9001",
    "gen_ai.usage.input_tokens": 7680,
    "gen_ai.usage.output_tokens": 5120,
    "gen_ai.usage.total_tokens": 12800,
    "gen_ai.response.finish_reasons": [
      "length"
    ],
    "cost.usd": 0.192
  },
  {
    "user.tenant.id": "tenant-demo",
    "schema_version": "0.1",
    "timestamp": "2026-06-04T15:01:40Z",
    "event.id": "pos-05",
    "event.action": "chat",
    "event.outcome": "success",
    "gen_ai.conversation.id": "conv-pos-05",
    "gen_ai.provider.name": "openai",
    "gen_ai.request.model": "gpt-4o",
    "app.name": "support-copilot",
    "app.env": "prod",
    "user.id": "u-burst-9001",
    "gen_ai.usage.input_tokens": 7800,
    "gen_ai.usage.output_tokens": 5200,
    "gen_ai.usage.total_tokens": 13000,
    "gen_ai.response.finish_reasons": [
      "length"
    ],
    "cost.usd": 0.195
  },
  {
    "user.tenant.id": "tenant-demo",
    "schema_version": "0.1",
    "timestamp": "2026-06-04T15:02:00Z",
    "event.id": "pos-06",
    "event.action": "chat",
    "event.outcome": "success",
    "gen_ai.conversation.id": "conv-pos-06",
    "gen_ai.provider.name": "openai",
    "gen_ai.request.model": "gpt-4o",
    "app.name": "support-copilot",
    "app.env": "prod",
    "user.id": "u-burst-9001",
    "gen_ai.usage.input_tokens": 7920,
    "gen_ai.usage.output_tokens": 5280,
    "gen_ai.usage.total_tokens": 13200,
    "gen_ai.response.finish_reasons": [
      "length"
    ],
    "cost.usd": 0.198
  },
  {
    "user.tenant.id": "tenant-demo",
    "schema_version": "0.1",
    "timestamp": "2026-06-04T15:02:20Z",
    "event.id": "pos-07",
    "event.action": "chat",
    "event.outcome": "success",
    "gen_ai.conversation.id": "conv-pos-07",
    "gen_ai.provider.name": "openai",
    "gen_ai.request.model": "gpt-4o",
    "app.name": "support-copilot",
    "app.env": "prod",
    "user.id": "u-burst-9001",
    "gen_ai.usage.input_tokens": 8040,
    "gen_ai.usage.output_tokens": 5360,
    "gen_ai.usage.total_tokens": 13400,
    "gen_ai.response.finish_reasons": [
      "length"
    ],
    "cost.usd": 0.201
  },
  {
    "user.tenant.id": "tenant-demo",
    "schema_version": "0.1",
    "timestamp": "2026-06-04T15:02:40Z",
    "event.id": "pos-08",
    "event.action": "chat",
    "event.outcome": "success",
    "gen_ai.conversation.id": "conv-pos-08",
    "gen_ai.provider.name": "openai",
    "gen_ai.request.model": "gpt-4o",
    "app.name": "support-copilot",
    "app.env": "prod",
    "user.id": "u-burst-9001",
    "gen_ai.usage.input_tokens": 8160,
    "gen_ai.usage.output_tokens": 5440,
    "gen_ai.usage.total_tokens": 13600,
    "gen_ai.response.finish_reasons": [
      "length"
    ],
    "cost.usd": 0.204
  },
  {
    "user.tenant.id": "tenant-demo",
    "schema_version": "0.1",
    "timestamp": "2026-06-04T15:03:00Z",
    "event.id": "pos-09",
    "event.action": "chat",
    "event.outcome": "success",
    "gen_ai.conversation.id": "conv-pos-09",
    "gen_ai.provider.name": "openai",
    "gen_ai.request.model": "gpt-4o",
    "app.name": "support-copilot",
    "app.env": "prod",
    "user.id": "u-burst-9001",
    "gen_ai.usage.input_tokens": 8280,
    "gen_ai.usage.output_tokens": 5520,
    "gen_ai.usage.total_tokens": 13800,
    "gen_ai.response.finish_reasons": [
      "length"
    ],
    "cost.usd": 0.207
  },
  {
    "user.tenant.id": "tenant-demo",
    "schema_version": "0.1",
    "timestamp": "2026-06-04T15:03:20Z",
    "event.id": "pos-10",
    "event.action": "chat",
    "event.outcome": "success",
    "gen_ai.conversation.id": "conv-pos-10",
    "gen_ai.provider.name": "openai",
    "gen_ai.request.model": "gpt-4o",
    "app.name": "support-copilot",
    "app.env": "prod",
    "user.id": "u-burst-9001",
    "gen_ai.usage.input_tokens": 8400,
    "gen_ai.usage.output_tokens": 5600,
    "gen_ai.usage.total_tokens": 14000,
    "gen_ai.response.finish_reasons": [
      "length"
    ],
    "cost.usd": 0.21
  },
  {
    "user.tenant.id": "tenant-demo",
    "schema_version": "0.1",
    "timestamp": "2026-06-04T15:03:40Z",
    "event.id": "pos-11",
    "event.action": "chat",
    "event.outcome": "success",
    "gen_ai.conversation.id": "conv-pos-11",
    "gen_ai.provider.name": "openai",
    "gen_ai.request.model": "gpt-4o",
    "app.name": "support-copilot",
    "app.env": "prod",
    "user.id": "u-burst-9001",
    "gen_ai.usage.input_tokens": 8520,
    "gen_ai.usage.output_tokens": 5680,
    "gen_ai.usage.total_tokens": 14200,
    "gen_ai.response.finish_reasons": [
      "length"
    ],
    "cost.usd": 0.213
  }
]
