{
  "schema_version": "0.1",
  "timestamp": "2026-06-04T18:00:00Z",
  "event.id": "6a000001-0000-4a00-8000-000000000001",
  "event.action": "execute_tool",
  "event.outcome": "success",
  "gen_ai.conversation.id": "conv-agent-6001",
  "gen_ai.provider.name": "openai",
  "gen_ai.request.model": "gpt-4o",
  "app.name": "ops-agent",
  "app.env": "prod",
  "user.id": "u-agent-6001",
  "gen_ai.agent.id": "agent-ops-1",
  "gen_ai.agent.name": "ops-assistant",
  "gen_ai.tool.type": "function",
  "gen_ai.tool.name": "send_email",
  "gen_ai.tool.call.id": "call-6001-2",
  "tool.call.depth": 2,
  "tool.call.chain": [
    "db.query",
    "send_email"
  ],
  "tool.call.outcome": "success"
}
